{
  "$schema": "http://json-schema.org/draft-07/schema#",
  "title": "Espresso Profile Schema",
  "type": "object",
  "additionalProperties": false,
  "properties": {
    "id": {
      "type": "string",
      "format": "uuid"
    },
    "label": {
      "type": "string"
    },
    "type": {
      "type": "string",
      "enum": [
        "standard",
        "pro"
      ]
    },
    "description": {
      "type": "string"
    },
    "temperature": {
      "type": "number"
    },
    "favorite": {
      "type": "boolean"
    },
    "selected": {
      "type": "boolean"
    },
    "phases": {
      "type": "array",
      "items": {
        "type": "object",
        "additionalProperties": false,
        "properties": {
          "name": {
            "type": "string"
          },
          "phase": {
            "type": "string",
            "enum": [
              "preinfusion",
              "brew"
            ]
          },
          "valve": {
            "type": "integer",
            "enum": [
              0,
              1
            ]
          },
          "duration": {
            "type": "number",
            "minimum": 0
          },
          "pump": {
            "oneOf": [
              {
                "type": "number",
                "enum": [
                  0,
                  1
                ]
              },
              {
                "type": "object",
                "additionalProperties": false,
                "properties": {
                  "target": {
                    "type": "string",
                    "enum": [
                      "pressure",
                      "flow"
                    ]
                  },
                  "pressure": {
                    "type": "number",
                    "minimum": 0
                  },
                  "flow": {
                    "type": "number",
                    "minimum": 0
                  }
                },
                "required": [
                  "target",
                  "pressure",
                  "flow"
                ]
              }
            ]
          },
          "targets": {
            "type": "array",
            "items": {
              "type": "object",
              "additionalProperties": false,
              "properties": {
                "type": {
                  "type": "string",
                  "enum": [
                    "volumetric",
                    "pressure"
                  ]
                },
                "value": {
                  "type": "number",
                  "minimum": 0
                }
              },
              "required": [
                "type",
                "value"
              ]
            }
          }
        },
        "required": [
          "name",
          "phase",
          "valve",
          "duration",
          "pump"
        ]
      }
    }
  },
  "required": [
    "id",
    "label",
    "type",
    "description",
    "phases"
  ]
}
